{
  "$schema": "http://json-schema.org/draft-07/schema#",
  "title": "NodeTemplate",
  "type": "object",
  "required": ["id", "version", "analysis_type", "metadata"],
  "properties": {
    "id": {
      "type": "string"
    },
    "version": {
      "type": "string"
    },
    "analysis_type": {
      "type": "string"
    },
    "links": {
      "type": "array",
      "items": { "type": "string" },
      "default": []
    },
    "confidence_threshold": {
      "type": "number"
    },
    "draft_content": {
      "type": "string"
    },
    "metadata": {
      "type": "object",
      "required": ["schema"],
      "properties": {
        "schema": { "type": "string" }
      },
      "additionalProperties": true
    }
  },
  "additionalProperties": false
}
